{
  "$schema": "../../packages/maintain/schemas/maintain.config.schema.json",
  "root": ".",
  "reportsDir": ".cursor/reports",
  "continueOnError": true,
  "maxParallel": 2,
  "checkers": {
    "invariants": {
      "routes": {
        "appFile": "src/App.tsx",
        "required": [
          "/",
          "/tasks",
          "/kanban",
          "/reports",
          "/admin",
          "/admin/dashboard"
        ]
      },
      "fixtures": {
        "pageFile": "fixtures/shared/page.json",
        "requiredPageDomains": [
          "crm",
          "admin"
        ]
      },
      "blocks": {
        "dir": "src/blocks",
        "indexFile": "src/blocks/index.ts",
        "recursive": true
      },
      "context": {
        "file": "src/data/adapters/fixtures.adapter.ts",
        "requiredSymbols": [
          "loadFixturesContextInput"
        ]
      }
    },
    "viewExports": {
      "pattern": "src/**/*View.tsx",
      "exportShape": "interface+function"
    },
    "dataClassConflicts": {
      "scope": ["src"],
      "pattern": "**/*.tsx",
      "ignoreDataClasses": ["wrapper"]
    },
    "componentTag": {
      "scope": ["src"],
      "pattern": "**/*.tsx",
      "tagMapPath": null
    },
    "colorTokens": {
      "scope": ["src"],
      "pattern": "**/*.tsx",
      "tokenSource": "utility-props.map",
      "utilityPropsMapPath": "./src/lib/utility-props.map.ts"
    },
    "genLint": {
      "scope": ["src/blocks", "src/layouts", "src/partials"],
      "pattern": "**/*.tsx",
      "rules": {
        "GEN001": "error",
        "GEN002": "error",
        "GEN003": "warn",
        "GEN004": "error",
        "GEN005": "warn",
        "GEN006": "error",
        "GEN007": "error",
        "GEN008": "warn"
      }
    },
    "clean": {
      "paths": ["../react-crm", "node_modules/.vite"],
      "pathsByMode": {
        "full": ["node_modules", "../react-crm"],
        "dist": ["../react-crm", "node_modules/.vite"]
      },
      "includeTsBuildInfo": true
    },
    "lockedDirs": {
      "dirs": ["src/assets", "src/components", "src/variants"],
      "pattern": "**/*.{ts,tsx,css,json}"
    },
    "viewHooks": {
      "pattern": "src/**/*View.tsx",
      "allowedHooks": []
    },
    "utilityPropLiterals": {
      "scope": ["src/blocks", "src/layouts", "src/partials"],
      "pattern": "**/*.tsx",
      "utilityPropsMapPath": "./src/lib/utility-props.map.ts",
      "allowDynamicInLoop": true
    },
    "utilityPropsWhitelist": {
      "utilityPropsMapPath": "./src/lib/utility-props.map.ts",
      "tailwindMapPath": "../../packages/generator/src/assets/tailwind/tw-css-extended.json",
      "additionalMapPaths": [
        "../../packages/generator/src/lib/shadcn.map.json",
        "../../packages/generator/src/lib/grid.map.json"
      ],
      "maxSuggestions": 2
    },
    "orphanFiles": {
      "scope": ["src"],
      "pattern": "**/*.{ts,tsx}",
      "ignore": ["src/main.tsx", "src/vite-env.d.ts", "src/App.tsx"],
      "aliases": { "@": "./src" }
    },
    "blockNesting": {
      "scope": ["src/blocks", "src/layouts", "src/partials"],
      "pattern": "**/*View.tsx"
    }
  }
}
